{
  "gatewayProfileId": "609a1b2c3d4e5f6a7b8c9d0e",
  "amount": 1250,
  "currency": "EUR",
  "returnUrl": "https://example.com/path/abc123",
  "reference": "string",
  "logoUrl": "https://example.com/path/abc123",
  "payer": {
    "name": "Deliverect's Pizza Place",
    "email": "customer@example.com",
    "reference": "string"
  }
}